name,topics,description,elements,endingType
Action,"['Action', 'Adventure']","Action films usually include high energy, big-budget physical stunts and chases, possibly with rescues, battles, fights, escapes, destructive crises (floods, explosions, natural disasters, fires, etc.), non-stop motion, spectacular rhythm and pacing, and adventurous, often two-dimensional 'good-guy' heroes (or recently, heroines) battling 'bad guys' - all designed for pure audience escapism.","['Explosions', 'Fight scenes']","['Happy ending', 'Tragic ending']"
Drama,"['Drama', 'Romance']","Drama films are serious presentations or stories with settings or life situations that portray realistic characters in conflict with either themselves, others, or forces of nature. A dramatic film shows us human beings at their best, their worst, and everything in-between.","['Emotional scenes', 'Dialogue']","[""Open ending""]"
Sci-Fi,['Sci-Fi'],"Science fiction films are usually scientific, visionary and imaginative complete with heroes, aliens, distant planets, impossible quests, improbable settings, fantastic places, great dark and shadowy villains, futuristic technology, unknown and unknowable forces, and extraordinary monsters ('creatures'), either created by mad scientists or by nuclear havoc.",['Element of Sci-Fi'],"['Happy ending', 'Tragic ending', 'Open ending']"
Romance,['Romance'],"Romance films are love stories, or affairs of the heart that center on passion, emotion, and the romantic, affectionate involvement of the main characters (usually a leading man and lady), and the journey that their love takes through courtship or marriage.",['Element of Romance'],"['Happy ending', 'Tragic ending', 'Open ending']"
Comedy,['Comedy'],"Comedy films are make 'em laugh films designed to elicit laughter from the audience. Comedies are light-hearted dramas, crafted to amuse, entertain, and provoke enjoyment. The comedy genre humorously exaggerates the situation, the language, action, and characters.",['Element of Comedy'],"['Happy ending', 'Tragic ending', 'Open ending']"
